"No.","Time","Source","Destination","Protocol","Length","Source Port","Destination Port","Host","Server","Source Mac","Dest Mac","Info"
"1","2015-05-29 10:23:52","10.3.162.105","10.3.162.105","TCP","54","62603","443","10.3.162.105","plus.l.google.com","78:2b:cb:1a:b2:08","00:1a:e2:1a:40:6a","62603  >  443 [ACK] Seq=4948 Ack=111823 Win=64360 Len=0"
"2","2015-05-29 10:23:52","10.3.162.105","10.3.162.105","TCP","66","62611","443","10.3.162.105","googlehosted.l.googleusercontent.com","78:2b:cb:1a:b2:08","00:1a:e2:1a:40:6a","62611  >  443 [SYN] Seq=0 Win=8192 Len=0 MSS=1460 WS=4 SACK_PERM=1"
"3","2015-05-29 10:23:52","10.3.162.2","10.3.162.2","DNS","164","53","59069","10.3.162.2","10.3.162.105","00:1a:e2:1a:40:6a","78:2b:cb:1a:b2:08","Standard query response 0xfb7f A oauth.googleusercontent.com CNAME googlehosted.l.googleusercontent.com A 173.194.123.44 A 173.194.123.42 A 173.194.123.43"
"4","2015-05-29 10:23:52","10.3.162.2","10.3.162.2","DNS","164","53","59069","10.3.162.2","10.3.162.105","00:1a:e2:1a:40:6a","78:2b:cb:1a:b2:08","Standard query response 0xfb7f A oauth.googleusercontent.com CNAME googlehosted.l.googleusercontent.com A 173.194.123.44 A 173.194.123.43 A 173.194.123.42"
"5","2015-05-29 10:23:52","173.194.123.10","173.194.123.10","TCP","66","443","62611","googlehosted.l.googleusercontent.com","10.3.162.105","00:1a:e2:1a:40:6a","78:2b:cb:1a:b2:08","443  >  62611 [SYN, ACK] Seq=0 Ack=1 Win=42900 Len=0 MSS=1367 SACK_PERM=1 WS=128"
"6","2015-05-29 10:23:52","10.3.162.105","10.3.162.105","TCP","54","62611","443","10.3.162.105","googlehosted.l.googleusercontent.com","78:2b:cb:1a:b2:08","00:1a:e2:1a:40:6a","62611  >  443 [ACK] Seq=1 Ack=1 Win=65616 Len=0"
"7","2015-05-29 10:23:52","10.3.162.105","10.3.162.105","TLSv1.2","223","62611","443","10.3.162.105","googlehosted.l.googleusercontent.com","78:2b:cb:1a:b2:08","00:1a:e2:1a:40:6a","Client Hello"
"8","2015-05-29 10:23:52","10.3.162.105","10.3.162.105","TCP","54","62609","443","10.3.162.105","ssl.gstatic.com","78:2b:cb:1a:b2:08","00:1a:e2:1a:40:6a","62609  >  443 [ACK] Seq=1513 Ack=10204 Win=64304 Len=0"
"9","2015-05-29 10:23:52","10.3.162.2","10.3.162.2","DNS","164","53","59069","10.3.162.2","10.3.162.105","00:1a:e2:1a:40:6a","78:2b:cb:1a:b2:08","Standard query response 0xfb7f A oauth.googleusercontent.com CNAME googlehosted.l.googleusercontent.com A 173.194.123.44 A 173.194.123.42 A 173.194.123.43"
"10","2015-05-29 10:23:52","173.194.123.10","173.194.123.10","TCP","54","443","62611","googlehosted.l.googleusercontent.com","10.3.162.105","00:1a:e2:1a:40:6a","78:2b:cb:1a:b2:08","443  >  62611 [ACK] Seq=1 Ack=170 Win=44032 Len=0"
"11","2015-05-29 10:23:52","173.194.123.10","173.194.123.10","TLSv1.2","1421","443","62611","googlehosted.l.googleusercontent.com","10.3.162.105","00:1a:e2:1a:40:6a","78:2b:cb:1a:b2:08","Server Hello"
"12","2015-05-29 10:23:52","173.194.123.10","173.194.123.10","TCP","1421","443","62611","googlehosted.l.googleusercontent.com","10.3.162.105","00:1a:e2:1a:40:6a","78:2b:cb:1a:b2:08","443  >  62611 [ACK] Seq=1368 Ack=170 Win=44032 Len=1367 [TCP segment of a reassembled PDU]"
"13","2015-05-29 10:23:52","173.194.123.10","173.194.123.10","TLSv1.2","995","443","62611","googlehosted.l.googleusercontent.com","10.3.162.105","00:1a:e2:1a:40:6a","78:2b:cb:1a:b2:08","Certificate, Server Key Exchange, Server Hello Done"
"14","2015-05-29 10:23:52","10.3.162.105","10.3.162.105","TCP","54","62611","443","10.3.162.105","googlehosted.l.googleusercontent.com","78:2b:cb:1a:b2:08","00:1a:e2:1a:40:6a","62611  >  443 [ACK] Seq=170 Ack=2735 Win=65616 Len=0"
"15","2015-05-29 10:23:52","10.3.162.105","10.3.162.105","TLSv1.2","180","62611","443","10.3.162.105","googlehosted.l.googleusercontent.com","78:2b:cb:1a:b2:08","00:1a:e2:1a:40:6a","Client Key Exchange, Change Cipher Spec, Encrypted Handshake Message"
"16","2015-05-29 10:23:52","173.194.123.10","173.194.123.10","TLSv1.2","105","443","62611","googlehosted.l.googleusercontent.com","10.3.162.105","00:1a:e2:1a:40:6a","78:2b:cb:1a:b2:08","Change Cipher Spec, Encrypted Handshake Message"
"17","2015-05-29 10:23:52","10.3.162.105","10.3.162.105","TLSv1.2","547","62611","443","10.3.162.105","googlehosted.l.googleusercontent.com","78:2b:cb:1a:b2:08","00:1a:e2:1a:40:6a","Application Data"
"18","2015-05-29 10:23:52","173.194.123.10","173.194.123.10","TLSv1.2","1421","443","62611","googlehosted.l.googleusercontent.com","10.3.162.105","00:1a:e2:1a:40:6a","78:2b:cb:1a:b2:08","Application Data [TCP segment of a reassembled PDU]"
"19","2015-05-29 10:23:52","173.194.123.10","173.194.123.10","TLSv1.2","1421","443","62611","googlehosted.l.googleusercontent.com","10.3.162.105","00:1a:e2:1a:40:6a","78:2b:cb:1a:b2:08","Application Data [TCP segment of a reassembled PDU]"
"20","2015-05-29 10:23:52","10.3.162.105","10.3.162.105","TCP","54","62611","443","10.3.162.105","googlehosted.l.googleusercontent.com","78:2b:cb:1a:b2:08","00:1a:e2:1a:40:6a","62611  >  443 [ACK] Seq=789 Ack=19981 Win=65616 Len=0"
"21","2015-05-29 10:23:52","173.194.123.10","173.194.123.10","TLSv1.2","1421","443","62611","googlehosted.l.googleusercontent.com","10.3.162.105","00:1a:e2:1a:40:6a","78:2b:cb:1a:b2:08","Application Data [TCP segment of a reassembled PDU]"
"22","2015-05-29 10:23:52","10.3.162.105","10.3.162.105","TCP","54","62611","443","10.3.162.105","googlehosted.l.googleusercontent.com","78:2b:cb:1a:b2:08","00:1a:e2:1a:40:6a","62611  >  443 [ACK] Seq=789 Ack=22715 Win=65616 Len=0"
"23","2015-05-29 10:23:52","173.194.123.10","173.194.123.10","TLSv1.2","1421","443","62611","googlehosted.l.googleusercontent.com","10.3.162.105","00:1a:e2:1a:40:6a","78:2b:cb:1a:b2:08","Application Data [TCP segment of a reassembled PDU]"
"24","2015-05-29 10:23:52","173.194.123.10","173.194.123.10","TLSv1.2","1421","443","62611","googlehosted.l.googleusercontent.com","10.3.162.105","00:1a:e2:1a:40:6a","78:2b:cb:1a:b2:08","Application Data [TCP segment of a reassembled PDU]"
"25","2015-05-29 10:23:52","10.3.162.105","10.3.162.105","TCP","54","62611","443","10.3.162.105","googlehosted.l.googleusercontent.com","78:2b:cb:1a:b2:08","00:1a:e2:1a:40:6a","62611  >  443 [ACK] Seq=789 Ack=25449 Win=65616 Len=0"
"26","2015-05-29 10:23:52","173.194.123.10","173.194.123.10","TLSv1.2","1421","443","62611","googlehosted.l.googleusercontent.com","10.3.162.105","00:1a:e2:1a:40:6a","78:2b:cb:1a:b2:08","Application Data [TCP segment of a reassembled PDU]"
"27","2015-05-29 10:23:52","173.194.123.10","173.194.123.10","TLSv1.2","497","443","62611","googlehosted.l.googleusercontent.com","10.3.162.105","00:1a:e2:1a:40:6a","78:2b:cb:1a:b2:08","Application Data"
"28","2015-05-29 10:23:52","10.3.162.105","10.3.162.105","TCP","54","62611","443","10.3.162.105","googlehosted.l.googleusercontent.com","78:2b:cb:1a:b2:08","00:1a:e2:1a:40:6a","62611  >  443 [ACK] Seq=789 Ack=27259 Win=65616 Len=0"
"29","2015-05-29 10:24:11","10.3.162.105","10.3.162.105","DHCP","342","68","67","10.3.162.105","255.255.255.255","78:2b:cb:1a:b2:08","ff:ff:ff:ff:ff:ff","DHCP Inform   - Transaction ID 0xa751ea34"
"30","2015-05-29 10:24:16","149.3.144.218","149.3.144.218","TCP","66","80","62612","sciclubtermeeuganee.it","10.3.162.105","00:1a:e2:1a:40:6a","78:2b:cb:1a:b2:08","80  >  62612 [SYN, ACK] Seq=0 Ack=1 Win=14600 Len=0 MSS=1367 SACK_PERM=1 WS=128"
"31","2015-05-29 10:24:16","10.3.162.105","10.3.162.105","TCP","54","62612","80","10.3.162.105","sciclubtermeeuganee.it","78:2b:cb:1a:b2:08","00:1a:e2:1a:40:6a","62612  >  80 [ACK] Seq=1 Ack=1 Win=65616 Len=0"
"32","2015-05-29 10:24:16","10.3.162.105","10.3.162.105","HTTP","608","62612","80","10.3.162.105","sciclubtermeeuganee.it","78:2b:cb:1a:b2:08","00:1a:e2:1a:40:6a","GET /wp-content/plugins/feedweb_data/pdf_efax_message_3537462.zip HTTP/1.1 "
"33","2015-05-29 10:24:16","149.3.144.218","149.3.144.218","TCP","54","80","62612","sciclubtermeeuganee.it","10.3.162.105","00:1a:e2:1a:40:6a","78:2b:cb:1a:b2:08","80  >  62612 [ACK] Seq=1 Ack=555 Win=15744 Len=0"
"341","2015-05-29 10:24:16","149.3.144.218","149.3.144.218","TCP","1421","80","62612","sciclubtermeeuganee.it","10.3.162.105","00:1a:e2:1a:40:6a","78:2b:cb:1a:b2:08","80  >  62612 [ACK] Seq=1 Ack=555 Win=15744 Len=1367 [TCP segment of a reassembled PDU]"
"35","2015-05-29 10:24:16","149.3.144.218","149.3.144.218","TCP","1421","80","62612","sciclubtermeeuganee.it","10.3.162.105","00:1a:e2:1a:40:6a","78:2b:cb:1a:b2:08","80  >  62612 [ACK] Seq=1368 Ack=555 Win=15744 Len=1367 [TCP segment of a reassembled PDU]"
"36","2015-05-29 10:24:16","149.3.144.218","149.3.144.218","TCP","1421","80","62612","sciclubtermeeuganee.it","10.3.162.105","00:1a:e2:1a:40:6a","78:2b:cb:1a:b2:08","80  >  62612 [ACK] Seq=2735 Ack=555 Win=15744 Len=1367 [TCP segment of a reassembled PDU]"
"37","2015-05-29 10:24:16","149.3.144.218","149.3.144.218","TCP","1421","80","62612","sciclubtermeeuganee.it","10.3.162.105","00:1a:e2:1a:40:6a","78:2b:cb:1a:b2:08","80  >  62612 [ACK] Seq=4102 Ack=555 Win=15744 Len=1367 [TCP segment of a reassembled PDU]"
"38","2015-05-29 10:24:16","10.3.162.105","10.3.162.105","TCP","54","62612","80","10.3.162.105","sciclubtermeeuganee.it","78:2b:cb:1a:b2:08","00:1a:e2:1a:40:6a","62612  >  80 [ACK] Seq=555 Ack=2735 Win=65616 Len=0"
"39","2015-05-29 10:24:16","10.3.162.105","10.3.162.105","TCP","54","62612","80","10.3.162.105","sciclubtermeeuganee.it","78:2b:cb:1a:b2:08","00:1a:e2:1a:40:6a","62612  >  80 [ACK] Seq=555 Ack=5469 Win=65616 Len=0"
"40","2015-05-29 10:24:16","149.3.144.218","149.3.144.218","TCP","1421","80","62612","sciclubtermeeuganee.it","10.3.162.105","00:1a:e2:1a:40:6a","78:2b:cb:1a:b2:08","80  >  62612 [ACK] Seq=5469 Ack=555 Win=15744 Len=1367 [TCP segment of a reassembled PDU]"
"41","2015-05-29 10:24:16","149.3.144.218","149.3.144.218","TCP","1421","80","62612","sciclubtermeeuganee.it","10.3.162.105","00:1a:e2:1a:40:6a","78:2b:cb:1a:b2:08","80  >  62612 [ACK] Seq=6836 Ack=555 Win=15744 Len=1367 [TCP segment of a reassembled PDU]"
"42","2015-05-29 10:24:16","149.3.144.218","149.3.144.218","TCP","1421","80","62612","sciclubtermeeuganee.it","10.3.162.105","00:1a:e2:1a:40:6a","78:2b:cb:1a:b2:08","80  >  62612 [ACK] Seq=8203 Ack=555 Win=15744 Len=1367 [TCP segment of a reassembled PDU]"
"43","2015-05-29 10:24:16","149.3.144.218","149.3.144.218","TCP","1421","80","62612","sciclubtermeeuganee.it","10.3.162.105","00:1a:e2:1a:40:6a","78:2b:cb:1a:b2:08","80  >  62612 [ACK] Seq=9570 Ack=555 Win=15744 Len=1367 [TCP segment of a reassembled PDU]"
"44","2015-05-29 10:24:16","149.3.144.218","149.3.144.218","TCP","1421","80","62612","sciclubtermeeuganee.it","10.3.162.105","00:1a:e2:1a:40:6a","78:2b:cb:1a:b2:08","80  >  62612 [ACK] Seq=10937 Ack=555 Win=15744 Len=1367 [TCP segment of a reassembled PDU]"
"45","2015-05-29 10:24:16","149.3.144.218","149.3.144.218","TCP","1421","80","62612","sciclubtermeeuganee.it","10.3.162.105","00:1a:e2:1a:40:6a","78:2b:cb:1a:b2:08","80  >  62612 [ACK] Seq=12304 Ack=555 Win=15744 Len=1367 [TCP segment of a reassembled PDU]"
"46","2015-05-29 10:24:16","10.3.162.105","10.3.162.105","TCP","54","62612","80","10.3.162.105","sciclubtermeeuganee.it","78:2b:cb:1a:b2:08","00:1a:e2:1a:40:6a","62612  >  80 [ACK] Seq=555 Ack=8203 Win=65616 Len=0"
"47","2015-05-29 10:24:16","10.3.162.105","10.3.162.105","TCP","54","62612","80","10.3.162.105","sciclubtermeeuganee.it","78:2b:cb:1a:b2:08","00:1a:e2:1a:40:6a","62612  >  80 [ACK] Seq=555 Ack=10937 Win=65616 Len=0"
